{
  "name": "Атакамски велики милиметарски/субмилиметарски низ (ALMA)",
  "place": "Висораван Чајнантор, пустиња Атакама, регија Антофагаста",
  "description": "Интерферометар од 66 радио-антена на висини од око 5.000 m који посматра милиметарске и субмилиметарске таласне дужине. Њиме управљају ESO, партнери из Северне Америке и источне Азије заједно са Чилеом.",
  "highlights": [
    "Прве слике објављене су 3. октобра 2011, а пуни оперативни статус постигао је у марту 2013.",
    "Проучава настанак звезда и планета, прашину и молекуле у свемиру и ране галаксије.",
    "Његов опсег таласних дужина је од 0,32 до 3,6 mm."
  ]
}
